<?xml version="1.0" encoding="UTF-8"?>
<jmx version="1.0"
     xmlns="http://jmx.collectd.org/xml/ns/definition" 
     xmlns:xsi="http://www.w3.org/2001/XMLSchema-instance" 
     xsi:schemaLocation="http://jmx.collectd.org/xml/ns/definition ../resources/META-INF/jmx_1.0.xsd">
    <mbeans name="dbcp2">
        <mbean name="org.ops4j.pax.jdbc.pool.dbcp2:type=GenericObjectPool,*" alias="GenericObjectPool">
            <attribute name="NumActive" alias="active"/>
            <attribute name="NumIdle" alias="idle"/>
            <attribute name="MaxTotal" alias="max total"/>
            <attribute name="MaxIdle" alias="max idle"/>
            <attribute name="NumWaiters" alias="waiters"/>
        </mbean>
    </mbeans>
</jmx>
