<?xml version="1.0" encoding="UTF-8"?>
<jmx version="1.0"
     xmlns="http://jmx.collectd.org/xml/ns/definition" 
     xmlns:xsi="http://www.w3.org/2001/XMLSchema-instance" 
     xsi:schemaLocation="http://jmx.collectd.org/xml/ns/definition ../../../../collectd-jmx/src/main/resources/META-INF/jmx_1.0.xsd">
    <mbeans name="jmx_dozer">
        <!--mbean name="org.dozer.jmx:type=DozerStatisticsController" type="dozer_cache">
            <attribute name="CacheHitCount"/>
            <attribute name="CacheMissCount"/>
        </mbean-->
        <mbean name="org.dozer.jmx:type=DozerStatisticsController" type="dozer_mapping" typeInstance="field_mapping">
            <attribute name="FieldMappingSuccessCount"/>
            <attribute name="FieldMappingFailureCount"/>
        </mbean>
        <mbean name="org.dozer.jmx:type=DozerStatisticsController" type="dozer_mapping" typeInstance="object_mapping">
            <attribute name="MappingSuccessCount"/>
            <attribute name="MappingFailureCount"/>
        </mbean>
    </mbeans>
</jmx>
